{
  "$schema": "http://json-schema.org/draft-07/schema#",
  "title": "ConsentConfigSchema",
  "type": "object",
  "required": ["schemaVersion", "policyVersion", "categories"],
  "properties": {
    "schemaVersion": {
      "type": "integer",
      "minimum": 1
    },
    "policyVersion": {
      "type": "string"
    },
    "legalEntity": {
      "type": "object",
      "properties": {
        "name": { "type": "string" },
        "tradeName": { "type": "string" },
        "taxId": { "type": "string" },
        "address": { "type": "string" },
        "email": { "type": "string" },
        "phone": { "type": "string" },
        "registryData": { "type": "string" },
        "dpoEmail": { "type": "string" },
        "activity": { "type": "string" },
        "websiteUrl": { "type": "string" }
      },
      "required": ["name"]
    },
    "legalNotice": {
      "type": "object",
      "properties": {
        "entity": { "$ref": "#/properties/legalEntity" },
        "applicableLaw": { "type": "string" },
        "jurisdiction": { "type": "string" },
        "lastUpdated": { "type": "string" }
      }
    },
    "jurisdiction": {
      "type": "array",
      "items": { "type": "string" }
    },
    "locale": {
      "type": "object",
      "properties": {
        "default": { "type": "string" },
        "autoDetect": { "type": "boolean" },
        "supported": {
          "type": "array",
          "items": { "type": "string" }
        }
      }
    },
    "translations": {
      "type": "object",
      "additionalProperties": {
        "type": "object",
        "properties": {
          "policy": {
            "type": "object",
            "properties": {
              "privacyUrl": { "type": "string" },
              "cookiesUrl": { "type": "string" }
            }
          },
          "ui": {
            "type": "object",
            "properties": {
              "banner": { "type": "object" },
              "preferences": { "type": "object" },
              "floatingBadge": { "type": "object" }
            }
          },
          "categories": {
            "type": "object",
            "additionalProperties": {
              "type": "object",
              "properties": {
                "label": { "type": "string" },
                "description": { "type": "string" }
              }
            }
          },
          "services": {
            "type": "object",
            "additionalProperties": {
              "type": "object",
              "properties": {
                "label": { "type": "string" },
                "provider": { "type": "string" }
              }
            }
          }
        }
      }
    },
    "policy": {
      "type": "object",
      "properties": {
        "privacyUrl": { "type": "string" },
        "cookiesUrl": { "type": "string" }
      }
    },
    "consent": {
      "type": "object",
      "properties": {
        "maxAgeDays": { "type": "integer", "default": 365 },
        "renewOnPolicyChange": { "type": "boolean", "default": true },
        "reloadOnRevoke": { "type": "string", "enum": ["auto", "always", "never"] }
      }
    },
    "gpc": {
      "type": "object",
      "properties": {
        "enabled": { "type": "boolean", "default": true },
        "respectSignal": { "type": "boolean", "default": true },
        "mode": { "type": "string", "enum": ["auto-reject", "notice-only"], "default": "auto-reject" },
        "categories": {
          "type": "array",
          "items": { "type": "string" }
        },
        "noticeText": { "type": "string" }
      }
    },
    "storage": {
      "type": "object",
      "properties": {
        "type": { "type": "string", "enum": ["cookie", "memory"] },
        "name": { "type": "string" },
        "path": { "type": "string" },
        "sameSite": { "type": "string", "enum": ["Lax", "Strict", "None"] },
        "secure": { "type": "boolean" }
      }
    },
    "categories": {
      "type": "object",
      "additionalProperties": {
        "type": "object",
        "required": ["required", "label", "description"],
        "properties": {
          "required": { "type": "boolean" },
          "default": { "type": "boolean" },
          "label": { "type": "string" },
          "description": { "type": "string" },
          "storageKeys": {
            "type": "array",
            "items": { "type": "string" }
          },
          "localStorage": {
            "type": "array",
            "items": { "type": "string" }
          },
          "sessionStorage": {
            "type": "array",
            "items": { "type": "string" }
          }
        }
      }
    },
    "services": {
      "type": "object",
      "additionalProperties": {
        "type": "object",
        "properties": {
          "preset": { "type": "string" },
          "category": { "type": "string" },
          "label": { "type": "string" },
          "provider": { "type": "string" },
          "policyUrl": { "type": "string" },
          "description": { "type": "string" },
          "consent": {
            "type": "object",
            "properties": {
              "mode": { "type": "string", "enum": ["required", "exempt"] },
              "legalReviewRequired": { "type": "boolean" },
              "reviewReference": { "type": "string" }
            }
          },
          "domains": {
            "type": "array",
            "items": { "type": "string" }
          },
          "cookies": {
            "type": "array",
            "items": {
              "type": "object",
              "properties": {
                "name": { "type": "string" },
                "duration": { "type": "string" },
                "domain": { "type": "string" },
                "purpose": { "type": "string" }
              }
            }
          },
          "storageKeys": {
            "type": "array",
            "items": { "type": "string" }
          },
          "localStorage": {
            "type": "array",
            "items": { "type": "string" }
          },
          "sessionStorage": {
            "type": "array",
            "items": { "type": "string" }
          },
          "resources": {
            "type": "object",
            "properties": {
              "iframes": {
                "type": "array",
                "items": { "type": "string" }
              },
              "scripts": {
                "type": "array",
                "items": { "type": "string" }
              }
            }
          },
          "placeholder": {
            "type": "object",
            "properties": {
              "enabled": { "type": "boolean" },
              "text": { "type": "string" },
              "allowButton": { "type": "string" }
            }
          },
          "adapter": {
            "type": "object",
            "properties": {
              "type": { "type": "string" },
              "config": { "type": "object" }
            }
          }
        }
      }
    },
    "ui": {
      "type": "object",
      "properties": {
        "position": { "type": "string", "enum": ["bottom", "top", "modal"] },
        "banner": {
          "type": "object",
          "properties": {
            "title": { "type": "string" },
            "description": { "type": "string" },
            "accept": { "type": "string" },
            "reject": { "type": "string" },
            "configure": { "type": "string" }
          }
        },
        "preferences": {
          "type": "object",
          "properties": {
            "title": { "type": "string" },
            "save": { "type": "string" },
            "acceptAll": { "type": "string" },
            "rejectAll": { "type": "string" }
          }
        },
        "floatingBadge": {
          "oneOf": [
            { "type": "boolean" },
            {
              "type": "object",
              "properties": {
                "enabled": { "type": "boolean" },
                "position": {
                  "type": "string",
                  "enum": ["bottom-left", "bottom-right", "top-left", "top-right"]
                },
                "label": { "type": "string" },
                "ariaLabel": { "type": "string" },
                "showLabel": { "type": "boolean" },
                "icon": {
                  "type": "string",
                  "enum": ["cookie", "shield", "settings"]
                },
                "visibility": {
                  "type": "string",
                  "enum": ["always", "after-consent"]
                }
              }
            }
          ]
        }
      }
    },
    "logging": {
      "type": "object",
      "properties": {
        "enabled": { "type": "boolean" },
        "endpoint": { "type": ["string", "null"] }
      }
    },
    "diagnostics": {
      "type": "object",
      "properties": {
        "enabled": { "type": "boolean" },
        "warnUnknownResources": { "type": "boolean" }
      }
    }
  }
}
