{
  "schemaVersion": 1,
  "policyVersion": "2026-08-23",
  "locale": {
    "default": "es",
    "autoDetect": true,
    "supported": ["es", "en", "ca", "eu", "gl"]
  },
  "policy": {
    "privacyUrl": "/politica-privacidad",
    "cookiesUrl": "/politica-cookies"
  },
  "ui": {
    "floatingBadge": {
      "enabled": true,
      "position": "bottom-left",
      "icon": "cookie",
      "label": "Cookies"
    }
  },
  "translations": {
    "en": {
      "policy": {
        "privacyUrl": "/privacy-policy",
        "cookiesUrl": "/cookie-policy"
      },
      "ui": {
        "banner": {
          "title": "Your privacy, your choice",
          "accept": "Accept all"
        },
        "floatingBadge": {
          "label": "Cookies",
          "tooltip": "Configure cookie preferences"
        }
      },
      "categories": {
        "analytics": {
          "label": "Usage Analytics",
          "description": "Allows aggregated usage measurement."
        },
        "marketing": {
          "label": "Marketing & Video",
          "description": "Allows embedded video playback and personalization."
        }
      }
    }
  },
  "categories": {
    "necessary": {
      "required": true,
      "label": "Necesarias",
      "description": "Cookies y almacenamiento técnico imprescindible para el funcionamiento de la web."
    },
    "analytics": {
      "required": false,
      "default": false,
      "label": "Analítica de uso",
      "description": "Nos permite medir el uso de la web de forma agregada."
    },
    "marketing": {
      "required": false,
      "default": false,
      "label": "Marketing y Vídeo",
      "description": "Permite la reproducción de vídeos incrustados y personalización."
    }
  },
  "services": {
    "ga4": {
      "category": "analytics",
      "label": "Google Analytics 4",
      "provider": "Google"
    },
    "youtube": {
      "category": "marketing",
      "label": "YouTube Embed",
      "provider": "Google"
    }
  }
}
